{"created_at":"1970-01-01T00:00:00.000Z","cross_reference_results":[{"check_class":"cross-reference","check_id":"assertion-subject","details":{"orphan_count":0},"evidence_refs":[],"message":"every assertion attaches to a repository or an artifact in this packet","rule":"assertions_resolve_to_a_subject","status":"passed"},{"check_class":"cross-reference","check_id":"artifact-cross-reference","details":{"missing_count":0},"evidence_refs":[],"message":"every repository artifact reference resolves","rule":"repository_artifact_ids_resolve","status":"passed"},{"check_class":"cross-reference","check_id":"edge-cross-reference","details":{"dangling_count":0},"evidence_refs":[],"message":"every relationship endpoint resolves to an emitted record","rule":"relationship_endpoints_resolve","status":"passed"}],"evidence_results":[{"check_class":"evidence","check_id":"assertion-evidence","details":{"unsupported_count":0},"evidence_refs":[],"message":"every assertion cites an exact source span and a hashed source file","rule":"assertions_cite_exact_sources","status":"passed"},{"check_class":"evidence","check_id":"evidence-resolves","details":{"dangling_count":0},"evidence_refs":[],"message":"every evidence reference resolves to an emitted evidence record","rule":"evidence_refs_resolve","status":"passed"},{"check_class":"evidence","check_id":"unknowns-preserved","details":{"unknown_artifacts":0},"evidence_refs":[],"message":"explicit Unknown content hashes are reported as diagnostics","rule":"unknowns_are_explicit","status":"passed"}],"invariant_results":[{"check_class":"invariant","check_id":"semantic-hash","details":{"calculated":"sha256:ecadce1b6112618e62bef653146b6919f327d5bcfbe2389984dc9cf20022741b","declared":"sha256:ecadce1b6112618e62bef653146b6919f327d5bcfbe2389984dc9cf20022741b"},"evidence_refs":[],"message":"declared semantic hash matches recomputation","rule":"semantic_hash_is_reproducible","status":"passed"},{"check_class":"invariant","check_id":"packet-id","details":{},"evidence_refs":[],"message":"packet id is derived from the semantic hash","rule":"packet_id_is_semantically_derived","status":"passed"},{"check_class":"invariant","check_id":"portable-paths","details":{"offending_count":0},"evidence_refs":[],"message":"every artifact source path is a portable repository-relative POSIX path","rule":"source_paths_are_repository_relative","status":"passed"},{"check_class":"invariant","check_id":"stable-ordering","details":{},"evidence_refs":[],"message":"artifacts are ordered by repository-relative path","rule":"ordering_is_explicit_and_stable","status":"passed"}],"packet_type":"l9.validation-receipt","packet_version":"1.0.0","receipt_id":"receipt:798980c8ae8f5868cb412d13e345afcdb0677cf584a8156ece47213c1c81f50d","schema_results":[{"check_class":"schema","check_id":"packet-type","details":{},"evidence_refs":[],"message":"packet_type is l9.repository-model","rule":"packet_type_is_repository_model","status":"passed"},{"check_class":"schema","check_id":"packet-version","details":{},"evidence_refs":[],"message":"packet_version is 1.1.0","rule":"packet_version_is_supported","status":"passed"},{"check_class":"schema","check_id":"source-revision","details":{},"evidence_refs":[],"message":"source snapshot revision is present","rule":"source_revision_is_explicit","status":"passed"},{"check_class":"schema","check_id":"payload-present","details":{},"evidence_refs":[],"message":"payload is inline and resolved","rule":"payload_is_resolved","status":"passed"}],"semantic_hash":"sha256:798980c8ae8f5868cb412d13e345afcdb0677cf584a8156ece47213c1c81f50d","status":"passed","subject_packet_id":"packet:ecadce1b6112618e62bef653146b6919f327d5bcfbe2389984dc9cf20022741b","subject_semantic_hash":"sha256:ecadce1b6112618e62bef653146b6919f327d5bcfbe2389984dc9cf20022741b","validator":{"name":"l9-meta-injector.repository-model","version":"4.2.0"}}
