{"created_at":"2026-07-21T03:22:47.032794Z","cross_reference_results":[{"check_class":"cross-reference","check_id":"repository-source-exists","details":{},"evidence_refs":[],"message":"source repository exists at the declared fallback root for l9-mcp-server","rule":"source_repository_exists","status":"passed"}],"evidence_results":[],"invariant_results":[],"packet_type":"l9.validation-receipt","packet_version":"1.0.0","receipt_id":"receipt:a0b688d41714091c2a892f7d62096d9bf3d15762219d1bea345ed6ccc4084292","schema_results":[{"check_class":"schema","check_id":"repository-scan-materialized","details":{},"evidence_refs":[],"message":"legacy scanner output was adapted into canonical repository records","rule":"canonical_records_materialized","status":"passed"}],"semantic_hash":"sha256:a0b688d41714091c2a892f7d62096d9bf3d15762219d1bea345ed6ccc4084292","status":"passed","subject_packet_id":"packet:14ed4a2e1e165a73d11b94243a3bbf6d7c6234df3da4499739523077e2780b1f","subject_semantic_hash":"sha256:14ed4a2e1e165a73d11b94243a3bbf6d7c6234df3da4499739523077e2780b1f","validator":{"name":"l9-constellation-topology.direct-observation-validator","version":"2.0.0"}}
