{"created_at":"2026-07-21T00:00:00Z","cross_reference_results":[{"check_class":"cross-reference","check_id":"repository-source-exists","details":{},"evidence_refs":[],"message":"source repository exists at the declared fallback root for l9-gate-sdk","rule":"source_repository_exists","status":"passed"}],"evidence_results":[],"invariant_results":[],"packet_type":"l9.validation-receipt","packet_version":"1.0.0","receipt_id":"receipt:8719351eae504a24c85923cb4b444184dcb98d6af64a626b423c9d6e0276a321","schema_results":[{"check_class":"schema","check_id":"repository-scan-materialized","details":{},"evidence_refs":[],"message":"legacy scanner output was adapted into canonical repository records","rule":"canonical_records_materialized","status":"passed"}],"semantic_hash":"sha256:8719351eae504a24c85923cb4b444184dcb98d6af64a626b423c9d6e0276a321","status":"passed","subject_packet_id":"packet:6de1ec9baa73aaebce0ef4b4c324fca15d74c898fef38452bf847fb5abdce23f","subject_semantic_hash":"sha256:6de1ec9baa73aaebce0ef4b4c324fca15d74c898fef38452bf847fb5abdce23f","validator":{"name":"l9-constellation-topology.direct-observation-validator","version":"2.0.0"}}
